{
  "session_id": "baseline2-sphinx-doc__sphinx-8593-2",
  "harness": "droid",
  "task_id": "sphinx-doc__sphinx-8593",
  "harness_session_id": "b236b235-9a75-447a-b4f0-8596ea491a1b",
  "steps": [
    {
      "tool_call_id": "toolu_0192DRQpt2ygFRSyrqDnPqvu",
      "message_id": "d11d6e5e-6182-4c0b-bb05-14684d9936db",
      "tool_name": "Grep",
      "snapshot_ref": "23bbd6ad3db299f76a87c6c78d96ba2824c29c36"
    },
    {
      "tool_call_id": "toolu_01EbmrysrsM4yKGVQ5ETEJdF",
      "message_id": "cb5b91d2-ab27-4dc6-a54a-cde881d94ff5",
      "tool_name": "Read",
      "snapshot_ref": "43175f3506f4bb9204a28319741b576d42025318"
    },
    {
      "tool_call_id": "toolu_01VRVmKZehhbgWL65Lcd1J8X",
      "message_id": "c8607249-1e6f-4af3-949d-2da43ed78c3c",
      "tool_name": "Execute",
      "snapshot_ref": "afc8a8a6498839b81f1ff0590c2b4df3f99972d0"
    },
    {
      "tool_call_id": "toolu_019qQ6svZ4FD11YpohHgZoCV",
      "message_id": "b19a894d-d213-42c8-afff-cf5cdaedf78c",
      "tool_name": "Edit",
      "snapshot_ref": "98cb21371180dc37eca54473b51ae5f4c31484f4"
    },
    {
      "tool_call_id": "toolu_014n2VHFxE8TyGPQHL9fonbh",
      "message_id": "9ec15218-3b1e-442c-aee4-00bb316290d3",
      "tool_name": "Execute",
      "snapshot_ref": "1bf06a21edce16ea90e028f6f2b758ea8e4b6380"
    },
    {
      "tool_call_id": "toolu_01VcZyGaeSL8AjBobihSxtVS",
      "message_id": "9533bbc4-3c61-449c-aa4a-594fce9df167",
      "tool_name": "Execute",
      "snapshot_ref": "9e6e87c353926b8a377bf582bcb307746758dba6"
    }
  ]
}
