{
  "session_id": "baseline1-sympy__sympy-20438-1",
  "harness": "droid",
  "task_id": "sympy__sympy-20438",
  "harness_session_id": "3c3a9381-8f22-4242-ad01-9ee39c8b82b2",
  "steps": [
    {
      "tool_call_id": "toolu_01ESsnx8pHC5mGCLFB1J5Hkh",
      "message_id": "117cc181-8523-405e-9875-e88a56808751",
      "tool_name": "Grep",
      "snapshot_ref": "b9b4dde40a7727bc29f56454fe969323ca91fb42"
    },
    {
      "tool_call_id": "toolu_01EAUXtEpDMVQTgAPrXJUnq6",
      "message_id": "122c29bf-a4f8-4c07-b897-97a46ee4be8f",
      "tool_name": "Read",
      "snapshot_ref": "653dfdbb258168ad68f1f384e0caeb1c6c3c5d4d"
    },
    {
      "tool_call_id": "toolu_015Jwn2o4iHmBLa6FHpzxUNx",
      "message_id": "122c29bf-a4f8-4c07-b897-97a46ee4be8f",
      "tool_name": "Read",
      "snapshot_ref": "653dfdbb258168ad68f1f384e0caeb1c6c3c5d4d"
    },
    {
      "tool_call_id": "toolu_01FDDyP2BLhSGuhAgzGnqP7C",
      "message_id": "0ce88ef0-81ae-473d-b0ce-95296c93c41e",
      "tool_name": "Grep",
      "snapshot_ref": "76eb6887041fcf6fa5816d34a8c199f8a7b69df7"
    },
    {
      "tool_call_id": "toolu_01FEbKScTGuReYzmvGRAdJAw",
      "message_id": "b11a3d5b-8380-40f5-8912-18c8df3128da",
      "tool_name": "Read",
      "snapshot_ref": "c4ba22b849ab35b3575c9f9cbc857734f90eb4ab"
    },
    {
      "tool_call_id": "toolu_019gdk4DP41K5NoPHWXf7USY",
      "message_id": "b11a3d5b-8380-40f5-8912-18c8df3128da",
      "tool_name": "Read",
      "snapshot_ref": "c4ba22b849ab35b3575c9f9cbc857734f90eb4ab"
    },
    {
      "tool_call_id": "toolu_01BdXgKxYSQrAFtyeTproDMs",
      "message_id": "6204016e-2645-4d1f-ba3d-6a7b02fcfc15",
      "tool_name": "Execute",
      "snapshot_ref": "3b833de94fbc834424ddf822624d533fabdf8e31"
    },
    {
      "tool_call_id": "toolu_01Jb22AZGgiVNQf3DVQCzd6D",
      "message_id": "432cd1c7-98dc-4751-af0d-48a0efdd5929",
      "tool_name": "Read",
      "snapshot_ref": "3d545cf8afef642100980178737e747bc40f2904"
    },
    {
      "tool_call_id": "toolu_01N9qU9q7kgjhYwr69qwU5dE",
      "message_id": "fc2bd781-f7d2-40c5-9eeb-53729436135c",
      "tool_name": "Grep",
      "snapshot_ref": "793bebfe57f74c97ad9b20a6e0dd5cabb5501ca1"
    },
    {
      "tool_call_id": "toolu_01XsZcURtG51ie1912RYPoEv",
      "message_id": "fc2bd781-f7d2-40c5-9eeb-53729436135c",
      "tool_name": "Grep",
      "snapshot_ref": "793bebfe57f74c97ad9b20a6e0dd5cabb5501ca1"
    },
    {
      "tool_call_id": "toolu_01JECmqGoTYRuYbSPXptdnwu",
      "message_id": "66c038c2-c881-43b2-8813-ab5736a3bda7",
      "tool_name": "Read",
      "snapshot_ref": "a35ca942457da0f0e9c2ce936be6c90d4bf1f863"
    },
    {
      "tool_call_id": "toolu_019GKkh2n4LxR4Bb6DqAvxb7",
      "message_id": "9aabf5f3-6051-4981-9d18-7cbd3dfc0c77",
      "tool_name": "Edit",
      "snapshot_ref": "9b04b889ffcd856a39b5d9605f8ad1bdf911fdee"
    },
    {
      "tool_call_id": "toolu_013Wkfba7cLCrC5MLuRV5kBo",
      "message_id": "9aabf5f3-6051-4981-9d18-7cbd3dfc0c77",
      "tool_name": "Edit",
      "snapshot_ref": "c295840ad0385d0df1aa46a754d7bc158efc9704"
    },
    {
      "tool_call_id": "toolu_011SiaWffHMbwR3q7GvQAFUv",
      "message_id": "c97304b0-4c0e-4a4d-b31b-12fa6ad95e01",
      "tool_name": "Edit",
      "snapshot_ref": "7fd3def01acde6556dde0af23d7c58b797c219a0"
    },
    {
      "tool_call_id": "toolu_0162XHPK1HjzwvrBSpRC2p78",
      "message_id": "c97304b0-4c0e-4a4d-b31b-12fa6ad95e01",
      "tool_name": "Execute",
      "snapshot_ref": "3160509d4cd69a26dda503faf61e880e1c75fc51"
    },
    {
      "tool_call_id": "toolu_016QEZLQ6Zsw6u6uSTjaUg7m",
      "message_id": "90832eb5-f01b-4144-b788-22ef55525b78",
      "tool_name": "Execute",
      "snapshot_ref": "33d5e40d01bedde8400969e4996945bffeb30846"
    },
    {
      "tool_call_id": "toolu_012R19fs4AFrSncpV8HCaoww",
      "message_id": "f15fdd05-d9bb-4dda-b7a0-67f141084473",
      "tool_name": "Execute",
      "snapshot_ref": "ddff739eb7f74e855311f49de524d97378fcf883"
    },
    {
      "tool_call_id": "toolu_01916BWri4rEzhRgxZT2zoCN",
      "message_id": "d28c4260-f780-434d-b9a0-856034c6833f",
      "tool_name": "Grep",
      "snapshot_ref": "791f25d299f6d71c2d6ebbb351573c01f37ed34d"
    },
    {
      "tool_call_id": "toolu_01PV761suGC1v7xYhguGcKDB",
      "message_id": "d28c4260-f780-434d-b9a0-856034c6833f",
      "tool_name": "Grep",
      "snapshot_ref": "791f25d299f6d71c2d6ebbb351573c01f37ed34d"
    },
    {
      "tool_call_id": "toolu_01Ek3yj3cGhbdwx1sDpMLqsB",
      "message_id": "f88ba85e-f28c-418b-b2be-d85afd12cdc8",
      "tool_name": "Read",
      "snapshot_ref": "8080d0d2eeb74c4e06ee27286084c12069a85cc7"
    },
    {
      "tool_call_id": "toolu_012MvwPoHJLrVG1JNxR4EbCd",
      "message_id": "f88ba85e-f28c-418b-b2be-d85afd12cdc8",
      "tool_name": "Read",
      "snapshot_ref": "8080d0d2eeb74c4e06ee27286084c12069a85cc7"
    },
    {
      "tool_call_id": "toolu_019EouDLReR2mUhfFMS1NRUY",
      "message_id": "c3dea8c1-521e-4b02-9554-e0b8caf4c975",
      "tool_name": "Edit",
      "snapshot_ref": "7201f3998bc6c8e3abc752fb71a80a4a06f1bb27"
    },
    {
      "tool_call_id": "toolu_01HDDnmEy6uGRf8hG3AmvwH6",
      "message_id": "c3dea8c1-521e-4b02-9554-e0b8caf4c975",
      "tool_name": "Edit",
      "snapshot_ref": "965b9da17e44aef6c661af2e6d9bec9440c02630"
    },
    {
      "tool_call_id": "toolu_01Rsi14CrbU7uPQeYr6Y8KBw",
      "message_id": "c5921ae7-0325-4ab5-9192-7889d87923f4",
      "tool_name": "Execute",
      "snapshot_ref": "77501d6b74dfe0129a7c31156128d7b31f70b339"
    },
    {
      "tool_call_id": "toolu_01Sxr8gGTGgs5YvSixtMmsH7",
      "message_id": "ecac6f2c-833c-4cc0-aa78-6a8882dd98ba",
      "tool_name": "Execute",
      "snapshot_ref": "e2f7d77d7e670b59895022d1dcf7786f7249d6f2"
    }
  ]
}
